{
  "$schema": "https://json-schema.org/draft/2020-12/schema",
  "$id": "https://folio.local/schemas/types/state-machine.schema.json",
  "title": "Folio State Machine Authoring Input",
  "type": "object",
  "additionalProperties": false,
  "required": ["schema_version", "kind", "title", "states", "transitions"],
  "allOf": [{"if":{"properties":{"canvas":{"const":"poster"}},"required":["canvas"]},"else":{"properties":{"height":{"maximum":800}}}}],
  "properties": {
    "schema_version": {"const": "3.0"},
    "kind": {"const": "state-machine"},
    "title": {"$ref": "#/$defs/non-empty-string"},
    "states": {"type": "array", "minItems": 1, "maxItems": 9, "items": {"$ref": "#/$defs/state"}},
    "transitions": {"type": "array", "maxItems": 14, "items": {"$ref": "#/$defs/transition"}},
    "persistent": {"type": "boolean"},
    "submachine": {"type": "boolean"},
    "axis": {"enum": ["left-right", "top-down"]},
    "focus": {"type": ["string", "null"]},
    "canvas": {"enum": ["figure", "poster"]},
    "width": {"const": 960},
    "height": {"type": "integer", "minimum": 500, "maximum": 4000, "multipleOf": 4},
    "language": {"$ref": "#/$defs/nullable-string"}
  },
  "$defs": {
    "nullable-string": {"oneOf": [{"type": "null"}, {"$ref": "#/$defs/non-empty-string"}]},
    "non-empty-string": {"type": "string", "pattern": ".*\\S.*"},
    "state": {
      "type": "object",
      "additionalProperties": false,
      "required": ["id", "type"],
      "properties": {
        "id": {"$ref": "#/$defs/non-empty-string"},
        "type": {"enum": ["state", "initial", "final", "choice"]},
        "label": {"type": ["string", "null"]},
        "description": {"type": ["string", "null"]},
        "emphasis": {"enum": ["focal", "normal", "background"]}
      },
      "allOf": [
        {
          "if": {"properties": {"type": {"enum": ["state", "choice"]}}, "required": ["type"]},
          "then": {"required": ["label"], "properties": {"label": {"$ref": "#/$defs/non-empty-string"}}}
        }
      ]
    },
    "transition": {
      "type": "object",
      "additionalProperties": false,
      "required": ["id", "source", "target"],
      "properties": {
        "id": {"$ref": "#/$defs/non-empty-string"},
        "source": {"$ref": "#/$defs/non-empty-string"},
        "target": {"$ref": "#/$defs/non-empty-string"},
        "event": {"type": ["string", "null"]},
        "guard": {"type": ["string", "null"]},
        "action": {"type": ["string", "null"]},
        "channel": {"enum": ["normal", "exceptional", "reset", "focal"]}
      }
    }
  }
}
